<?xml version="1.0" encoding="UTF-8"?>
<xs:schema xmlns:xs="http://www.w3.org/2001/XMLSchema"
	targetNamespace="http://www.uniovi.es"
	xmlns="http://www.uniovi.es"
	elementFormDefault="qualified">
	<xs:element name="circuito">
		<xs:complexType>
			<xs:sequence>
				<xs:element ref="nombre" />
				<xs:element ref="longitudCircuito" />
				<xs:element ref="anchuraMedia" />
				<xs:element ref="fechaCarrera" />
				<xs:element ref="horaInicio" />
				<xs:element ref="numVueltas" />
				<xs:element ref="localidad" />
				<xs:element ref="pais" />
				<xs:element ref="referencias" />
				<xs:element ref="fotografias" />
				<xs:element ref="videos" />
				<xs:element ref="coordenadas" />
				<xs:element ref="tramos" />
			</xs:sequence>
		</xs:complexType>
	</xs:element>
	<xs:element name="nombre" type="xs:string" />
	<xs:element name="longitudCircuito">
		<xs:complexType>
			<xs:simpleContent>
				<xs:extension base="xs:float">
					<xs:attribute name="unidad" type="xs:string" use="required" />
				</xs:extension>
			</xs:simpleContent>
		</xs:complexType>
	</xs:element>
	<xs:element name="anchuraMedia">
		<xs:complexType>
			<xs:simpleContent>
				<xs:extension base="xs:float">
					<xs:attribute name="unidad" type="xs:string" use="required" />
				</xs:extension>
			</xs:simpleContent>
		</xs:complexType>
	</xs:element>
	<xs:element name="fechaCarrera" type="xs:date" />
	<xs:element name="horaInicio" type="xs:time" />
	<xs:element name="numVueltas" type="xs:int" />
	<xs:element name="localidad" type="xs:string" />
	<xs:element name="pais" type="xs:string" />
	<xs:element name="referencias">
		<xs:complexType>
			<xs:sequence>
				<xs:element minOccurs="3" maxOccurs="unbounded" ref="referencia" />
			</xs:sequence>
		</xs:complexType>
	</xs:element>
	<xs:element name="referencia" type="xs:string" />
	<xs:element name="fotografias">
		<xs:complexType>
			<xs:sequence>
				<xs:element minOccurs="1" maxOccurs="5" ref="fotografia" />
			</xs:sequence>
		</xs:complexType>
	</xs:element>
	<xs:element name="fotografia" type="xs:string" />
	<xs:element name="videos">
		<xs:complexType>
			<xs:sequence>
				<xs:element minOccurs="0" maxOccurs="3" ref="video" />
			</xs:sequence>
		</xs:complexType>
	</xs:element>
	<xs:element name="video" type="xs:string" />
	<xs:element name="coordenadas">
		<xs:complexType>
			<xs:sequence>
				<xs:element ref="longitud" />
				<xs:element ref="latitud" />
				<xs:element ref="altitud" />
			</xs:sequence>
		</xs:complexType>
	</xs:element>
	<xs:element name="longitud" >
		<xs:simpleType>
			<xs:restriction base="xs:float">
				<xs:minInclusive value="-180"></xs:minInclusive>
				<xs:maxInclusive value="180"></xs:maxInclusive>
			</xs:restriction>
		</xs:simpleType>	
	</xs:element>
	<xs:element name="latitud" >
		<xs:simpleType>
			<xs:restriction base="xs:float">
				<xs:minInclusive value="-90"></xs:minInclusive>
				<xs:maxInclusive value="90"></xs:maxInclusive>
			</xs:restriction>
		</xs:simpleType>
	</xs:element>
	<xs:element name="altitud" >
		<xs:simpleType>
			<xs:restriction base="xs:int">
				<xs:minInclusive value="0"></xs:minInclusive>
				<xs:maxInclusive value="16"></xs:maxInclusive>
			</xs:restriction>
		</xs:simpleType>
	</xs:element>
	<xs:element name="tramos">
		<xs:complexType>
			<xs:sequence>
				<xs:element minOccurs="1" maxOccurs="unbounded" ref="tramo" />
			</xs:sequence>
		</xs:complexType>
	</xs:element>
	<xs:element name="tramo">
		<xs:complexType>
			<xs:sequence>
				<xs:element ref="distanciaTramo" />
				<xs:element ref="coordenadas" />
				<xs:element ref="nSector" />
			</xs:sequence>
		</xs:complexType>
	</xs:element>
	<xs:element name="distanciaTramo">
		<xs:complexType>
			<xs:simpleContent>
				<xs:extension base="xs:double">
					<xs:attribute name="unidad" type="xs:string" use="required" />
				</xs:extension>
			</xs:simpleContent>
		</xs:complexType>
	</xs:element>
	<xs:element name="nSector" type="xs:int" />
</xs:schema>